{
  "$schema": "https://json-schema.org/draft/2020-12/schema",
  "$id": "https://schemas.commandlayer.org/schemas/v1.0.0/trust/endorse/endorse.request.schema.json",
  "title": "CLAS Trust Endorse Request",
  "description": "A request to endorse a subject, claim, agent, action, artifact, or credential.",
  "type": "object",
  "additionalProperties": false,
  "required": ["version", "family", "verb", "endorser", "subject", "endorsement"],
  "properties": {
    "version": { "const": "1.0.0" },
    "family": { "const": "trust" },
    "verb": { "const": "endorse" },
    "endorser": { "type": "string", "minLength": 1 },
    "subject": {
      "type": "object",
      "additionalProperties": true,
      "required": ["type", "id"],
      "properties": {
        "type": { "type": "string", "minLength": 1 },
        "id": { "type": "string", "minLength": 1 }
      }
    },
    "endorsement": {
      "type": "object",
      "additionalProperties": false,
      "required": ["statement"],
      "properties": {
        "statement": { "type": "string", "minLength": 1 },
        "scope": { "type": "string" },
        "confidence": { "type": "number", "minimum": 0, "maximum": 1 }
      }
    },
    "context": { "type": "object", "additionalProperties": true }
  }
}
